{
  "acceptance_criteria": [
    "The revision addresses every [critical] disputed point or defends it with evidence.",
    "Every acceptance criterion in the revised set is objectively passable/failable by the Quality Reviewer against a frozen inventory.",
    "The scope split (I into a/b/c; H into verification + bounded corrections) is accepted or refuted with evidence, not preference.",
    "The missing source reports are supplied or their absence is dispositioned.",
    "No new scope enters without a named uncertainty, frozen scope, and rollback condition (THEORY_001 \u00a710's own guardrail)."
  ],
  "accepted_points": [
    "THEORY_001 \u00a73.1 is exactly accurate: all fourteen validator counts and both deck warnings reproduce verbatim against commit 3c2e9fa.",
    "The stabilization-over-redesign posture and the frozen objective (\u00a71) are accepted.",
    "\u00a74.4's exclusions match PIGMENT.md \u00a72 and \u00a711 exactly and are accepted without dispute.",
    "\u00a79.1 frozen terms all match shipped strings; no terminology drift has occurred.",
    "\u00a73.3's epistemic guardrails are preserved verbatim and were the standard this challenge was held to.",
    "The Explore promise mismatch is confirmed (js/app.js:1463 vs :1336) and is the best-value item in the document.",
    "The deck-pool warnings have real user impact (every deck ships 3 of 4 quadrant anchors); Workstream B is sound.",
    "Generic platform attribution does not establish item-level rights; verified as documentation debt, not as active exposure."
  ],
  "assumptions": [
    "Target deployment remains https://ardagemci.github.io/painters-atlas/#/.",
    "The rollback anchor is commit 3c2e9fa45645d787da3754417448bbcebfd4029a on main.",
    "Gate 1 remains in force until the Coordinator freezes a specification; nothing in this round edits production files.",
    "Provenance evidence need not live in shipped data files unless the theory pole shows otherwise (THEORY_001 never states that it must).",
    "Release positioning (editorial discovery/taste product vs historical reference) is undecided and owned by MIRA/the product owner."
  ],
  "confidence": "high \u2014 every challenge is grounded in file:line evidence, measured browser observation, or counted data; medium on effort figures, which are labeled estimates throughout",
  "created_at": "2026-07-21T13:10:00Z",
  "disputed_points": [
    "[critical] The acceptance set cannot be passed as written: criteria 10-11 demand source/confidence/rights fields no schema holds; 12 is a negative existential; the Release rule then closes human_review_ready permanently.",
    "[critical] Workstream I is not bounded stabilization: aggregate coverage plus fact/legend/disputed UI is schema design, corpus migration, audit, and new UI in sequence.",
    "[critical] Two release blockers absent from THEORY_001 are confirmed in shipped code: mergePassports last-writer-wins overwrites persona.adopted (js/app.js:2921-2923) under import copy claiming 'nothing is dropped' (:2941); onboarding state is memory-only (let ob=null, :2548) with random reseeding, so interruption destroys all progress unwarned.",
    "[major] Eight of twelve \u00a73.3 gaps trace to no available source report; two are now measured (U1 confirmed 0-of-8 destinations visible at 320px; U2 partially confirmed - overflow exists but the root never user-scrolls), one is refuted as written (U5: prefix already outranks substring) while concealing worse retrieval defects.",
    "[major] \u00a72.2 describes as open a first-action decision the shipped build already made (entry-card order + primary accent, js/app.js:1447, css:535-541).",
    "[major] \u00a74.2's search-label fix is a no-op (index.html:47 already reads 'Search the atlas...'); the defective element is the aria-label and the blur-on-dismiss behavior.",
    "[major] THEORY_001 never references PIGMENT.md \u00a716 and silently reorders it; \u00a716.1's adaptivity mandate collides with Workstream B.3 (ADMIRE_SPEC.md:100 claims adaptive delivery; buildDeck is stratified, called once).",
    "[major] The envelope violates the frozen schema on eight counts and bypassed the Kernel by direct commit; content is sound, process exception is recorded, a conforming re-envelope is requested."
  ],
  "evidence": [
    "protocol/tasks/PIG-001/intake-baseline.md (build identity; unedited validator output; contradictions C1-C4)",
    "protocol/tasks/PIG-001/liaison-incoming-analysis.json (Duchamp, incoming)",
    "protocol/tasks/PIG-001/challenge-analysis-caravaggio.md (30 findings, file:line grounded)",
    "protocol/tasks/PIG-001/ux-requirements.md (Mondrian: 24-route inventory, 18 control types, ARIA counts, 24-query fixture, R1-R18)",
    "protocol/tasks/PIG-001/browser-evidence.md (Vermeer: measured U1/U2 verdicts; evidence/home__{320,390,1280}__dark.png)",
    "protocol/tasks/PIG-001/data-integrity-report.md (Seurat: 255 pd / 60 copyright / 528 gallery images; 0 died>1955 violations; Matisse/Kahlo inconsistency)",
    "protocol/tasks/PIG-001/feasibility-assessment.md (Durer: A-J classification; 14 units; contrast-without-Node method; ?v= non-uniformity)",
    "protocol/tasks/PIG-001/decision-record.md (D-001..D-010)"
  ],
  "message_type": "challenge",
  "next_state": "theory_revision",
  "project": "pigment",
  "proposal": "See body: \u00a73 challenges with severity and evidence; \u00a74 recorded adaptations; \u00a75 the four-way classification THEORY_001 \u00a70 demands, the 14-unit smallest reversible plan, the evidence list required before human_review_ready, and the rollback procedure; \u00a77 seven answerable questions. Core structural proposal: split Workstream I (rights register now, hybrid schema target; claim sourcing gated on release positioning; uncertainty UI deferred), repair the acceptance set per the triage table, and proceed to a frozen specification covering the classified blockers and low-risk inclusions only.",
  "rationale": "THEORY_001 is accurate where checkable and its posture is right, but it audits promises without re-inspecting the build: it names one instance of a five-site bug, proposes an already-shipped fix, misses the two worst Taste-layer defects, and sets a finish line that cannot be crossed. The challenge repairs the gate, bounds the scope honestly, and surfaces the decisions only the owner can make - without editing a single production file.",
  "recipient": "coordinator",
  "requested_actions": [
    "Supply NIKO_001.md, ELARA_001.md, ARGUS_001.md and the VERA review, or disposition their absence in writing.",
    "Resend THEORY_001 under a schema-conforming envelope (message_type theory_brief, task_id PIG-001); the Kernel records the original arrival as a process exception.",
    "Accept or dispute each criteria rewrite in \u00a75.3; where disputed, supply an alternative objective form.",
    "Accept or refute the Workstream I split and the hybrid provenance container (\u00a73 CH-2, \u00a77 Q3).",
    "Route the owner decisions in \u00a77 Q5-Q7 to MIRA/the product owner.",
    "Return a revision or defense within one round (PROTOCOL.md \u00a71 step 3)."
  ],
  "risks": [
    "The two confirmed Taste-layer blockers are live in production today; each deliberation round extends exposure.",
    "Re-scoring deck coordinates to clear validator warnings must remain honest on the merits; tuning taste data to silence a warning would corrupt the product's core signal (D-010).",
    "The Matisse/Kahlo cross-store rights inconsistency is unresolved licensing policy (D-009); galleries currently render both.",
    "Over-fixing before a frozen specification would violate Gate 1; all fixes remain plans until authorization.",
    "Three of six source reports remain uninspectable; any revision resting on them inherits the gap."
  ],
  "round": 1,
  "sender": "claude-synthesis-lead",
  "summary": "Claude accepts THEORY_001's stabilization objective and confirms its data snapshot exactly. We challenge: the acceptance set is unpassable as written (criteria 10-12 demand fields no schema holds; most of P2 cannot be adjudicated); Workstream I is a second project wearing evidence-gate clothes. Two release blockers THEORY_001 missed are confirmed in shipped code: imported Passports silently overwrite adopted Personas, and onboarding progress is memory-only. We return a four-way classification, a 14-unit reversible plan, criteria rewrites, and seven questions.",
  "task_id": "PIG-001",
  "workflow_state": "challenge"
}
